ID, Name, Gender, Field
bdd73a39-29bb-48c7-bb46-4e85078420f5, Tran Quang Ha, F, 0033fd2f-b767-4ac8-b2cd-e4a1dfb47b1e
b9dcb40b-5d8b-4be8-80a2-54d31520fbce, Le Gia Anh, F, 104656dc-691d-436c-badc-a4b15ac0cd11
d26424b9-854a-484b-941a-227df8389626, Le Ngoc Long, M, 7184120e-4198-4853-803e-dca9091f87da
99d698ec-22d3-4f14-803a-03d32077c254, Ly Quang Ha, F, 04883a90-b086-4087-be9c-a78cf1663cb4
666bf698-734b-41fe-a55a-c6d48c4add41, Le Quang Giang, F, fc4b73ed-c216-41f2-90f0-9da93f155831
6402a5d9-5114-43f9-8a26-a0e2d8460398, Ly Hai Ha, F, 0033fd2f-b767-4ac8-b2cd-e4a1dfb47b1e
1f6cb984-5e13-4813-95fc-947284eb02a2, Le Ngoc Hung, M, 7184120e-4198-4853-803e-dca9091f87da
c32791a9-a330-48c6-8e30-9064749da8ba, Tran Thanh Ha, F, db248fe8-0433-4474-886e-bbaa8393956a
970770c4-737f-45f9-826b-4787fac7ce00, Le Quang Son, M, 04883a90-b086-4087-be9c-a78cf1663cb4
8fba7418-6e70-449f-8210-ed4b2b8911de, Le Thanh Phuong, F, a97b7fa0-ac8b-4594-bcbe-5b13b89ba385
6fc53cad-2015-4007-aad4-06999ea027b9, Ly Hai Long, M, 04883a90-b086-4087-be9c-a78cf1663cb4
6a03655c-bf59-4e62-af2d-b41dcd218f0c, Ly Quang Long, M, 0033fd2f-b767-4ac8-b2cd-e4a1dfb47b1e
d2685c3e-09c6-4b00-9996-c5084882a064, Le Ngoc Phuong, F, a97b7fa0-ac8b-4594-bcbe-5b13b89ba385
ae395a4d-f30b-4024-b38e-2bb758d03d19, Nguyen Ly Giang, F, 7184120e-4198-4853-803e-dca9091f87da
49217c55-ce86-4d83-8a27-26d9e027ebe9, Tran Thanh Duc, M, 104656dc-691d-436c-badc-a4b15ac0cd11
07185a11-ddeb-42a4-a46f-e2f1663c31a9, Tran Gia Hung, M, 04883a90-b086-4087-be9c-a78cf1663cb4
9914ea55-04a3-4bc2-9173-d231220cd776, Ly Ngoc Hung, M, 04883a90-b086-4087-be9c-a78cf1663cb4
a2ffaae1-ef40-40b9-98dd-40824197eaee, Nguyen Hai Duc, M, fc4b73ed-c216-41f2-90f0-9da93f155831
88e75f4e-2fe2-4b25-a232-cbb44120226e, Nguyen Ly Ha, F, 104656dc-691d-436c-badc-a4b15ac0cd11
3b42dcd3-8112-46bc-8bf7-574992803f3a, Ly Thanh Thu, F, 104656dc-691d-436c-badc-a4b15ac0cd11
dbf9e502-0331-4c9c-8466-0e18d274c1dc, Le Hai Giang, F, 04883a90-b086-4087-be9c-a78cf1663cb4
3e67c7c8-2f19-4bf7-8c6d-63bb13173c89, Ly Ly Son, M, a97b7fa0-ac8b-4594-bcbe-5b13b89ba385
9f9cdc9c-a21b-43c9-a66b-4404d53ab7c8, Dinh Quang Son, M, 04883a90-b086-4087-be9c-a78cf1663cb4
8cad1762-7d43-4435-8445-8da116d65507, Nguyen Ly Son, M, db248fe8-0433-4474-886e-bbaa8393956a
d7905fc2-7f59-4e40-9e55-c2b0979795b6, Le Ly Thu, F, 04883a90-b086-4087-be9c-a78cf1663cb4
6b7684f2-e815-472e-8584-4f9cd9e59ceb, Ly Thanh Thu, F, 0033fd2f-b767-4ac8-b2cd-e4a1dfb47b1e
edd168bb-2221-455e-82a9-1b93e6a6bf2a, Ly Thanh Tan, M, 04883a90-b086-4087-be9c-a78cf1663cb4
40e69584-5bd9-49c2-bd9f-6944c235ba31, Nguyen Ngoc Giang, F, fc4b73ed-c216-41f2-90f0-9da93f155831
2be289e4-8811-4b6d-a792-4f5121ed0b1a, Le Quang Giang, F, 4436af20-d7c7-421b-849b-079a18b000d1
69938957-8687-4bc8-aadf-0005d2b7c87f, Tran Gia Loc, M, fc4b73ed-c216-41f2-90f0-9da93f155831
